{
  "schema_version": 2,
  "repository": "Yangjunjie-Lin/ModelDock",
  "gate_set_version": 2,
  "gates": [
    { "id": "software_license", "title": "Software license owner and counsel approval", "profiles": ["COMMERCIAL_BETA", "MARKETPLACE_PRODUCTION"], "required_roles": ["Owner", "Legal"], "notes": "Owner and counsel decision remains unresolved." },
    { "id": "legal_entity", "title": "Operating legal entity approval", "profiles": ["COMMERCIAL_BETA", "MARKETPLACE_PRODUCTION"], "required_roles": ["Owner", "Legal"], "notes": "No approved entity evidence has been supplied." },
    { "id": "terms_of_service", "title": "Terms of service counsel approval", "profiles": ["COMMERCIAL_BETA", "MARKETPLACE_PRODUCTION"], "required_roles": ["Legal"], "notes": "Public text is a draft pending counsel review." },
    { "id": "privacy_policy", "title": "Privacy policy counsel approval", "profiles": ["COMMERCIAL_BETA", "MARKETPLACE_PRODUCTION"], "required_roles": ["Legal"], "notes": "Public text is a draft pending counsel review." },
    { "id": "refund_policy", "title": "Refund policy counsel and finance approval", "profiles": ["COMMERCIAL_BETA", "MARKETPLACE_PRODUCTION"], "required_roles": ["Finance", "Legal"], "notes": "Synthetic refund behavior is not legal or finance approval." },
    { "id": "payment_provider_agreement", "title": "Production payment-provider agreement", "profiles": ["COMMERCIAL_BETA", "MARKETPLACE_PRODUCTION"], "required_roles": ["Finance", "Legal"], "notes": "Only sandbox and manual-transfer adapters exist." },
    { "id": "provider_commercial_rights", "title": "Provider commercial distribution approval", "profiles": ["COMMERCIAL_BETA", "MARKETPLACE_PRODUCTION"], "required_roles": ["Commercial", "Legal"], "notes": "No contract-backed resale authorization has been supplied." },
    { "id": "provider_regions", "title": "Provider customer and data-processing region approval", "profiles": ["COMMERCIAL_BETA", "MARKETPLACE_PRODUCTION"], "required_roles": ["Commercial", "Legal"], "notes": "No contract-backed regional evidence is approved." },
    { "id": "production_smtp", "title": "Production SMTP delivery verification", "profiles": ["COMMERCIAL_BETA", "MARKETPLACE_PRODUCTION"], "required_roles": ["Operations"], "notes": "Only local capture is evidenced." },
    { "id": "managed_pitr_restore", "title": "Managed PostgreSQL PITR and backup restore drill", "profiles": ["COMMERCIAL_BETA", "MARKETPLACE_PRODUCTION"], "required_roles": ["Operations"], "notes": "Local pg_dump/pg_restore does not satisfy this gate." },
    { "id": "production_failover", "title": "Production multi-zone failover drill", "profiles": ["COMMERCIAL_BETA", "MARKETPLACE_PRODUCTION"], "required_roles": ["Operations"], "notes": "Local container interruption does not satisfy this gate." },
    { "id": "independent_security_assessment", "title": "Independent security assessment and disposition", "profiles": ["COMMERCIAL_BETA", "MARKETPLACE_PRODUCTION"], "required_roles": ["IndependentTester", "Security"], "notes": "No independent penetration-test evidence exists." },
    { "id": "current_vulnerability_scan", "title": "Current release-commit vulnerability scan approval", "profiles": ["COMMERCIAL_BETA", "MARKETPLACE_PRODUCTION"], "required_roles": ["Security"], "notes": "Must bind the exact commit and all candidate image digests." },
    { "id": "finance_signoff", "title": "Finance owner sign-off", "profiles": ["COMMERCIAL_BETA", "MARKETPLACE_PRODUCTION"], "required_roles": ["Finance"], "notes": "Human approval required." },
    { "id": "operations_signoff", "title": "Operations owner sign-off", "profiles": ["COMMERCIAL_BETA", "MARKETPLACE_PRODUCTION"], "required_roles": ["Operations"], "notes": "Human approval required." },
    { "id": "security_signoff", "title": "Security owner sign-off", "profiles": ["COMMERCIAL_BETA", "MARKETPLACE_PRODUCTION"], "required_roles": ["Security"], "notes": "Human approval required." },
    { "id": "legal_signoff", "title": "Legal owner sign-off", "profiles": ["COMMERCIAL_BETA", "MARKETPLACE_PRODUCTION"], "required_roles": ["Legal"], "notes": "Human approval required." },
    { "id": "supplier_kyb", "title": "At least one real supplier KYB approval", "profiles": ["MARKETPLACE_PRODUCTION"], "required_roles": ["Commercial", "Legal"], "notes": "Synthetic supplier fixtures are not KYB evidence." },
    { "id": "supplier_contract", "title": "Supplier contract approval", "profiles": ["MARKETPLACE_PRODUCTION"], "required_roles": ["Commercial", "Legal"], "notes": "No real supplier contract is approved." },
    { "id": "endpoint_ownership", "title": "Supplier endpoint ownership verification", "profiles": ["MARKETPLACE_PRODUCTION"], "required_roles": ["Security"], "notes": "No real supplier endpoint evidence exists." },
    { "id": "provider_quality_probe", "title": "Real Provider quality probe", "profiles": ["MARKETPLACE_PRODUCTION"], "required_roles": ["Operations"], "notes": "Synthetic probe results are engineering evidence only." },
    { "id": "canary_traffic", "title": "Controlled real canary traffic", "profiles": ["MARKETPLACE_PRODUCTION"], "required_roles": ["Operations"], "notes": "No contracted supplier canary is evidenced." },
    { "id": "production_payout", "title": "Production payout institution and destination workflow", "profiles": ["MARKETPLACE_PRODUCTION"], "required_roles": ["Finance", "Legal"], "notes": "The bundled sandbox payout adapter is permanently test-only." },
    { "id": "tax_and_invoice", "title": "Supplier tax and invoice process", "profiles": ["MARKETPLACE_PRODUCTION"], "required_roles": ["Finance", "Legal"], "notes": "External tax approval is absent." },
    { "id": "supplier_bill_reconciliation", "title": "Real supplier bill reconciliation", "profiles": ["MARKETPLACE_PRODUCTION"], "required_roles": ["Finance"], "notes": "Synthetic reconciliation does not satisfy production evidence." },
    { "id": "marketplace_dispute_drill", "title": "Marketplace dispute and refund allocation drill", "profiles": ["MARKETPLACE_PRODUCTION"], "required_roles": ["Finance", "Operations"], "notes": "Requires approved parties and production-like evidence." },
    { "id": "payout_idempotency", "title": "Real payout replay and idempotency verification", "profiles": ["MARKETPLACE_PRODUCTION"], "required_roles": ["Finance", "Operations"], "notes": "Sandbox replay is engineering evidence only." },
    { "id": "marketplace_second_admin", "title": "Marketplace second-administrator approval", "profiles": ["MARKETPLACE_PRODUCTION"], "required_roles": ["Owner"], "notes": "Human four-eyes approval is required." },
    { "id": "supplier_exit_drill", "title": "Supplier suspension, cutover, and exit drill", "profiles": ["MARKETPLACE_PRODUCTION"], "required_roles": ["Commercial", "Operations"], "notes": "No real supplier exit drill exists." },
    { "id": "final_go_live", "title": "Final accountable go-live approval", "profiles": ["COMMERCIAL_BETA", "MARKETPLACE_PRODUCTION"], "required_roles": ["Owner", "Legal", "Finance", "Security", "Operations"], "notes": "All accountable functions must sign the exact candidate after every prerequisite is complete." }
  ]
}
